{
  "schema_version": "mold.minimax-h3.layer-output.v1",
  "family": "minimax-h3",
  "case_id": "synthetic-coupled-update-v1",
  "layer": "dual-sampler",
  "authority_tier": "synthetic",
  "authorization_document_sha256": null,
  "input": {
    "id": "synthetic-v1",
    "sha256": "bddf9a6b821015094aedba95dd58a7634a783c9338dd6d488e66bd8d5fcd182a",
    "component_index_sha256": "a2b6a210e482ffb78e613b553f570c44e101afce6741bd4ed91429d0559af031"
  },
  "producer": {
    "role": "mold",
    "implementation": "mold-synthetic-adapter",
    "source_id": "mold",
    "revision": "ea3d1d86fbd09eb6d47848649168c70392db9c63"
  },
  "adapter": {
    "schema_version": "mold.minimax-h3.layer-adapter.v1",
    "id": "mold-synthetic-adapter-synthetic-dual-sampler-v1",
    "command": "python3 scripts/minimax-h3-conformance.py print-synthetic-output --role mold",
    "tensor_hash_encoding": "canonical-json-numeric-v1"
  },
  "environment": {
    "device": "cpu-synthetic",
    "dtype": "float32",
    "attention_backend": "scalar-python",
    "forbidden_accelerations_disabled": true
  },
  "outputs": [
    {
      "key": "video_next",
      "shape": [4],
      "dtype": "float32",
      "content_sha256": "d775157b364dba9b441d9f37d774ca51e48bfdd8b360fe9fcc40632cc53e848a",
      "statistics": {
        "min": -1.794285774230957,
        "max": 0.8457143902778625,
        "mean": -0.28035713732242584,
        "std": 0.9919803289710825
      },
      "samples": [
        { "index": [0], "value": 0.30142855644226074 },
        { "index": [1], "value": -0.47428572177886963 },
        { "index": [2], "value": 0.8457143902778625 },
        { "index": [3], "value": -1.794285774230957 }
      ]
    },
    {
      "key": "audio_next",
      "shape": [4],
      "dtype": "float32",
      "content_sha256": "41e890ccbd50e000293f45244366a6ea5925c50a0869e6e19294b5149e45b7c4",
      "statistics": {
        "min": -2.2571420669555664,
        "max": 1.1285724639892578,
        "mean": -0.312499038875103,
        "std": 1.235573732930605
      },
      "samples": [
        { "index": [0], "value": 0.18571528792381287 },
        { "index": [1], "value": -0.30714184045791626 },
        { "index": [2], "value": 1.1285724639892578 },
        { "index": [3], "value": -2.2571420669555664 }
      ]
    }
  ]
}
