{
  "schema_version": "mold.minimax-h3.layer-output.v1",
  "family": "minimax-h3",
  "case_id": "synthetic-coupled-update-v1",
  "layer": "dual-sampler",
  "authority_tier": "synthetic",
  "authorization_document_sha256": null,
  "input": {
    "id": "synthetic-v1",
    "sha256": "bddf9a6b821015094aedba95dd58a7634a783c9338dd6d488e66bd8d5fcd182a",
    "component_index_sha256": "a2b6a210e482ffb78e613b553f570c44e101afce6741bd4ed91429d0559af031"
  },
  "producer": {
    "role": "oracle",
    "implementation": "diffusers",
    "source_id": "diffusers",
    "revision": "9c6a68c32b3b2a64db91800b624d33cec6e25ab8"
  },
  "adapter": {
    "schema_version": "mold.minimax-h3.layer-adapter.v1",
    "id": "diffusers-synthetic-dual-sampler-v1",
    "command": "python3 scripts/minimax-h3-conformance.py print-synthetic-output --role oracle",
    "tensor_hash_encoding": "canonical-json-numeric-v1"
  },
  "environment": {
    "device": "cpu-synthetic",
    "dtype": "float32",
    "attention_backend": "scalar-python",
    "forbidden_accelerations_disabled": true
  },
  "outputs": [
    {
      "key": "video_next",
      "shape": [4],
      "dtype": "float32",
      "content_sha256": "d775157b364dba9b441d9f37d774ca51e48bfdd8b360fe9fcc40632cc53e848a",
      "statistics": {
        "min": -1.794285774230957,
        "max": 0.8457143902778625,
        "mean": -0.28035713732242584,
        "std": 0.9919803289710825
      },
      "samples": [
        { "index": [0], "value": 0.30142855644226074 },
        { "index": [1], "value": -0.47428572177886963 },
        { "index": [2], "value": 0.8457143902778625 },
        { "index": [3], "value": -1.794285774230957 }
      ]
    },
    {
      "key": "audio_next",
      "shape": [4],
      "dtype": "float32",
      "content_sha256": "69f58cd653742e88dbd287d97d9baf50df0813b2a8ea313b5a3c3a4c9f0fe18c",
      "statistics": {
        "min": -2.257143020629883,
        "max": 1.1285715103149414,
        "mean": -0.3125000186264515,
        "std": 1.2355737283596053
      },
      "samples": [
        { "index": [0], "value": 0.18571428954601288 },
        { "index": [1], "value": -0.30714285373687744 },
        { "index": [2], "value": 1.1285715103149414 },
        { "index": [3], "value": -2.257143020629883 }
      ]
    }
  ],
  "comparison": [
    {
      "key": "video_next",
      "absolute": 0.0,
      "relative": 0.0,
      "metric": "elementwise-atol-plus-rtol",
      "hash_policy": "exact"
    },
    {
      "key": "audio_next",
      "absolute": 0.000002,
      "relative": 0.000001,
      "metric": "elementwise-atol-plus-rtol",
      "hash_policy": "record-only"
    }
  ]
}
